{
  "schema_version": "v2",
  "generated_at": "2026-09-14T01:24:16Z",
  "generator": {
    "notebook": "notebooks/01_pass_rate_wilson.ipynb",
    "notebook_url": "https://factory.projectbluefin.io/methods/01_pass_rate_wilson.html",
    "workflow_run_url": "https://github.com/projectbluefin/lab/actions/runs/34795489119",
    "commit_sha": "c38125b89dad7c6e3ef0617bd50a848004e960ce",
    "inputs_sha256": "bf01aef8d2c994a92a2a2fbcf763ad8fa4a1e69ae81246e4f93438d9ea68cdd8",
    "library_versions": {
      "statsmodels": "0.14.6",
      "scipy": "1.18.0",
      "pandas": "3.0.5",
      "jsonschema": "4.26.0",
      "nbformat": "5.11.0",
      "nbconvert": "7.17.1",
      "papermill": "2.7.0",
      "jupyter": "1.1.1"
    }
  },
  "metrics": [
    {
      "id": "trust_window_pass_rate.bluefin-lts.testing.developer.contributor",
      "label": "T pass-rate (contributor window) - bluefin-lts/testing/developer",
      "value": 1.0,
      "ci_lower": 0.856883381549573,
      "ci_upper": 0.9999999999999999,
      "ci_level": 0.95,
      "n": 23,
      "unit": "proportion",
      "method": "wilson_score_95",
      "method_citation": "Wilson, E. B. (1927). Probable inference, the law of succession, and statistical inference. JASA 22(158):209-212.",
      "window": {
        "type": "rolling_hours",
        "size": 24,
        "audience": "contributor"
      },
      "confidence": "medium",
      "state": "fresh",
      "context": {
        "variant": "bluefin-lts",
        "branch": "testing",
        "suite": "developer",
        "audience": "contributor"
      },
      "formula": "p_hat = passes/n; CI = Wilson score interval at 95%",
      "numerator": 23,
      "denominator": 23,
      "failure_modes": [
        {
          "id": "small_sample",
          "description": "n<30; CI width may exceed 10 percentage points",
          "active": true,
          "threshold": "n<30",
          "evidence_url": null
        },
        {
          "id": "noniid_scenarios",
          "description": "Wilson assumes independent Bernoulli trials. Scenarios in the same run share infrastructure (same VM, same kernel, same network) and are not independent. CI may undercount.",
          "active": true,
          "threshold": null,
          "evidence_url": null
        },
        {
          "id": "flake_masking_regression",
          "description": "A scenario that passes intermittently inflates pass-rate even when a real regression is present",
          "active": false,
          "threshold": "future: KM survival AUC<0.7",
          "evidence_url": null
        }
      ],
      "evidence": [
        {
          "kind": "raw-input",
          "url": "https://github.com/projectbluefin/testing-lab/blob/main/docs/results/bluefin-lts-testing-developer.json",
          "path": "docs/results/bluefin-lts-testing-developer.json",
          "sha256": "aa4609108ded38a7936c5b874ed00246bd90ac10bb6f0a93f3e3eeadb09965e5"
        }
      ]
    },
    {
      "id": "trust_window_pass_rate.bluefin-lts.testing.developer.user",
      "label": "T pass-rate (user window) - bluefin-lts/testing/developer",
      "value": 1.0,
      "ci_lower": 0.9676757685506868,
      "ci_upper": 0.9999999999999999,
      "ci_level": 0.95,
      "n": 115,
      "unit": "proportion",
      "method": "wilson_score_95",
      "method_citation": "Wilson, E. B. (1927). Probable inference, the law of succession, and statistical inference. JASA 22(158):209-212.",
      "window": {
        "type": "rolling_hours",
        "size": 168,
        "audience": "user"
      },
      "confidence": "high",
      "state": "fresh",
      "context": {
        "variant": "bluefin-lts",
        "branch": "testing",
        "suite": "developer",
        "audience": "user"
      },
      "formula": "p_hat = passes/n; CI = Wilson score interval at 95%",
      "numerator": 115,
      "denominator": 115,
      "failure_modes": [
        {
          "id": "small_sample",
          "description": "n<30; CI width may exceed 10 percentage points",
          "active": false,
          "threshold": "n<30",
          "evidence_url": null
        },
        {
          "id": "noniid_scenarios",
          "description": "Wilson assumes independent Bernoulli trials. Scenarios in the same run share infrastructure (same VM, same kernel, same network) and are not independent. CI may undercount.",
          "active": true,
          "threshold": null,
          "evidence_url": null
        },
        {
          "id": "flake_masking_regression",
          "description": "A scenario that passes intermittently inflates pass-rate even when a real regression is present",
          "active": false,
          "threshold": "future: KM survival AUC<0.7",
          "evidence_url": null
        }
      ],
      "evidence": [
        {
          "kind": "raw-input",
          "url": "https://github.com/projectbluefin/testing-lab/blob/main/docs/results/bluefin-lts-testing-developer.json",
          "path": "docs/results/bluefin-lts-testing-developer.json",
          "sha256": "aa4609108ded38a7936c5b874ed00246bd90ac10bb6f0a93f3e3eeadb09965e5"
        }
      ]
    },
    {
      "id": "trust_window_pass_rate.bluefin-lts.testing.developer.downstream",
      "label": "T pass-rate (downstream window) - bluefin-lts/testing/developer",
      "value": 1.0,
      "ci_lower": 0.9676757685506868,
      "ci_upper": 0.9999999999999999,
      "ci_level": 0.95,
      "n": 115,
      "unit": "proportion",
      "method": "wilson_score_95",
      "method_citation": "Wilson, E. B. (1927). Probable inference, the law of succession, and statistical inference. JASA 22(158):209-212.",
      "window": {
        "type": "rolling_hours",
        "size": 720,
        "audience": "downstream"
      },
      "confidence": "high",
      "state": "fresh",
      "context": {
        "variant": "bluefin-lts",
        "branch": "testing",
        "suite": "developer",
        "audience": "downstream"
      },
      "formula": "p_hat = passes/n; CI = Wilson score interval at 95%",
      "numerator": 115,
      "denominator": 115,
      "failure_modes": [
        {
          "id": "small_sample",
          "description": "n<30; CI width may exceed 10 percentage points",
          "active": false,
          "threshold": "n<30",
          "evidence_url": null
        },
        {
          "id": "noniid_scenarios",
          "description": "Wilson assumes independent Bernoulli trials. Scenarios in the same run share infrastructure (same VM, same kernel, same network) and are not independent. CI may undercount.",
          "active": true,
          "threshold": null,
          "evidence_url": null
        },
        {
          "id": "flake_masking_regression",
          "description": "A scenario that passes intermittently inflates pass-rate even when a real regression is present",
          "active": false,
          "threshold": "future: KM survival AUC<0.7",
          "evidence_url": null
        }
      ],
      "evidence": [
        {
          "kind": "raw-input",
          "url": "https://github.com/projectbluefin/testing-lab/blob/main/docs/results/bluefin-lts-testing-developer.json",
          "path": "docs/results/bluefin-lts-testing-developer.json",
          "sha256": "aa4609108ded38a7936c5b874ed00246bd90ac10bb6f0a93f3e3eeadb09965e5"
        }
      ]
    },
    {
      "id": "trust_window_pass_rate.bluefin-lts.testing.smoke.contributor",
      "label": "T pass-rate (contributor window) - bluefin-lts/testing/smoke",
      "value": 0.976530612244898,
      "ci_lower": 0.9688383126483519,
      "ci_upper": 0.982358634340308,
      "ci_level": 0.95,
      "n": 1960,
      "unit": "proportion",
      "method": "wilson_score_95",
      "method_citation": "Wilson, E. B. (1927). Probable inference, the law of succession, and statistical inference. JASA 22(158):209-212.",
      "window": {
        "type": "rolling_hours",
        "size": 24,
        "audience": "contributor"
      },
      "confidence": "high",
      "state": "fresh",
      "context": {
        "variant": "bluefin-lts",
        "branch": "testing",
        "suite": "smoke",
        "audience": "contributor"
      },
      "formula": "p_hat = passes/n; CI = Wilson score interval at 95%",
      "numerator": 1914,
      "denominator": 1960,
      "failure_modes": [
        {
          "id": "small_sample",
          "description": "n<30; CI width may exceed 10 percentage points",
          "active": false,
          "threshold": "n<30",
          "evidence_url": null
        },
        {
          "id": "noniid_scenarios",
          "description": "Wilson assumes independent Bernoulli trials. Scenarios in the same run share infrastructure (same VM, same kernel, same network) and are not independent. CI may undercount.",
          "active": true,
          "threshold": null,
          "evidence_url": null
        },
        {
          "id": "flake_masking_regression",
          "description": "A scenario that passes intermittently inflates pass-rate even when a real regression is present",
          "active": false,
          "threshold": "future: KM survival AUC<0.7",
          "evidence_url": null
        }
      ],
      "evidence": [
        {
          "kind": "raw-input",
          "url": "https://github.com/projectbluefin/testing-lab/blob/main/docs/results/bluefin-lts-testing-smoke.json",
          "path": "docs/results/bluefin-lts-testing-smoke.json",
          "sha256": "e6e5a43a69ea0875ebdb42a2e45adc7bb63064ccde92bc1675823d417376587d"
        }
      ]
    },
    {
      "id": "trust_window_pass_rate.bluefin-lts.testing.smoke.user",
      "label": "T pass-rate (user window) - bluefin-lts/testing/smoke",
      "value": 0.9758503401360544,
      "ci_lower": 0.9716048656798242,
      "ci_upper": 0.9794744655980132,
      "ci_level": 0.95,
      "n": 5880,
      "unit": "proportion",
      "method": "wilson_score_95",